{
  "version": "1.0",
  "policyName": "research-kb-access",
  "assignee": {
    "type": "user",
    "identifier": "user-002"
  },
  "scope": {
    "tenantId": "tenant-midwest-health"
  },
  "active": true,
  "expiresAt": "2026-07-01T00:00:00Z",
  "audit": {
    "grantedBy": "admin-jane-doe",
    "grantedAt": "2026-01-15T10:00:00Z",
    "reason": "Temporary access for research project ending June 2026"
  }
}
