{
  "version": "1.0",
  "policyName": "marketing-baseline",
  "assignee": {
    "type": "user",
    "identifier": "user-marketing-001"
  },
  "scope": {
    "tenantId": "tenant-acme-retail"
  },
  "active": true,
  "audit": {
    "grantedBy": "admin-jane-doe",
    "grantedAt": "2026-09-01T09:00:00Z",
    "reason": "Baseline marketing access, purpose-agnostic"
  }
}
